{
  "case_id": "case-2026-06-30-335",
  "agent_id": "ralph-autonomous-loop",
  "timestamp": "2026-06-30T04:25:00Z",
  "project": "1BfrYW9R",
  "work_unit": "tests:progress-sync — 修正 PROGRESS.md 组件计数漂移并落 ⑧ 严格守卫",
  "situation": "scout-scan 推荐 #1 项目 1BfrYW9R，健康度良好、推荐单位为「可跳过或文档润色」。读 PROGRESS.md 发现门禁核销里程碑行仍声明组件计数 29（build.js 实测报 30），与 .opt-direction=tests:progress-sync 方向直接相关。深查根因：npm test ⑧ 守卫的严格模式正则为 N 个 JSX/React 组件，PROGRESS.md 原文用「29/29 JSX 组件」「29 个唯一 PascalCase 组件」非严格形（缺「个」+JSX/React 紧邻），被 ⑧ 跳过致 PROGRESS.md 长期零守卫——README/CLAUDE.md/GATES.md 均已严格形落守卫报 30，唯独 PROGRESS.md 漂移无人捕获。属结构性守卫盲区，非单纯文档润色。",
  "action": "改 PROGRESS.md 门禁核销行为严格形「30 个 JSX 组件」并修正计数 29→30，附注说明原非严格形被 ⑧ 跳过的根因及本次落守卫意图。未改 smoke.test.js 逻辑（⑧ 正则已支持该形，PROGRESS.md 此前 0 严格匹配故被跳过，现 1 严格匹配即落守卫）。单文件改动。",
  "files_changed": ["1BfrYW9R/PROGRESS.md"],
  "worktree": "opt-tests-1782793346 (path /home/admin/workspace/.opt-worktrees/1BfrYW9R/opt-tests-1782793346, commit da8cfa9, branch auto/opt-tests-1782793346)",
  "direction": "tests:progress-sync",
  "outcome": "succeeded",
  "outcome_evidence": [
    "node build.js stdout: Build OK — 30 JSX components (single-file bundle)（实跑确认计数 30，证 PROGRESS.md 原 29 为漂移）",
    "npm test → 31 pass 0 fail（改后全套件绿，⑧ 未误报）",
    "node 复算 ⑧ 严格正则 /\\d+\\s*个\\s*(?:JSX|React)\\s*组件/g：PROGRESS.md strict-matches=[30,30] 无 drift（改前为 [] 被跳过）；README=[30,30,30] CLAUDE=[30] GATES=[30,30,30] CONTRIBUTING=[] 均无 drift",
    "git -C worktree show --stat HEAD：da8cfa9，PROGRESS.md 1 file changed 1 insertion 1 deletion",
    "1BfrYW9R main porcelain 空（cmd_commit 第 ③ 步还原 main，改动仅存 worktree）"
  ],
  "next_suggestion": "下轮可人工审 opt-tests-1782793346 diff 后 merge 入 1BfrYW9R main（onedaybot-dev）。另：1BfrYW9R 已 31 回归锁近饱和、NICE 仅余 Phase 1 真实后端 API 接入（依赖 personal-assistant 后端，跨项目，留后），后续若再排 #1 可考虑跳过该项目的自我润色，让位给 AS #2 的待合并 worktree triage（更实质）。"
}
