{
  "case_id": "case-2026-06-28-070",
  "agent_id": "ralph-loop",
  "timestamp": "2026-06-28T10:25:00Z",
  "project": "autonomous-studio",
  "work_unit": "fix scout-scan recommendation list: actionable items buried by blocked 等合并 items",
  "situation": "scout-scan 推荐列表 top 3 全是「等合并 PROGRESS.md」——不可操作的 blocked 项。真正可做的工作（补 GATES.md、triage TODO、刷新 stale PROGRESS）被挤出推荐。根因：work_unit 用 first-match 优先级链，「PROGRESS 缺+pending」先于「GATES 真缺」命中；排序只按 score 不区分 actionable/blocked。",
  "action": "1) work_unit 选择从 first-match if/elif 链改为 actionable/blocked 两桶收集，优先选 actionable[0]; 2) 排序加 (actionable DESC, score DESC) 二级键; 3) health_priority 返回 actionable 标志; 4) 文本输出加 ⏳blocked 标签区分。",
  "files_changed": ["scripts/scout-scan.py"],
  "worktree": "opt-scanner-1782642804",
  "direction": "scanner:recommend-actionable",
  "outcome": "succeeded",
  "outcome_evidence": "修复前 #1-3 全是「等合并 PROGRESS.md」；修复后 #1 1BfrYn9G → 补 GATES.md（可操作），排序正确。JSON --json 输出验证 actionable=True 标志正确传递。",
  "next_suggestion": "按修复后推荐：1BfrYn9G 补 GATES.md（#1 可操作项）；或 x-tool 刷新 stale PROGRESS.md（8.4 天）"
}
