{
  "case_id": "case-2026-06-29-047",
  "agent_id": "autonomous-studio-aone:engine:merge-optimization-worktree",
  "timestamp": "2026-06-29T13:50Z",
  "project": "autonomous-studio",
  "work_unit": "合并待合并 optimization worktree（case-046 的 scout-scan.py _STRIP_BACKTICKS 假阳修复）→ main",
  "situation": "scout-scan 报 #1=autonomous-studio(score=0.07, TODO=6 active, deferred=7)，推荐 triage TODO。状态文件 NEXT_SUGGESTION #1 = 合并待合并 optimization worktree(auto/optimization, commit 20c9dca, case-046)。核查：optimization worktree diff main..auto/optimization 仅 scripts/scout-scan.py +10/-1，即 case-046 的 _STRIP_BACKTICKS 行内反引号剥离修复（消除扫描器自指假阳）。用 worktree 副本复算验证：AS active 6→4、deferred 7→4（apply_resource_access.py:85/90 + bff_client.py:206 + scaffold-skill.sh:136 共 4 个真实 TODO(deferred) 代码标记全保留），open-design TODO=1 不变证无副作用，ast.parse 通过。该 worktree 从当前 main HEAD(c129918) 分出，无分叉，squash 应 fast-forward。尝试 opt-worktree.sh . merge optimization 失败：cmd_merge 把裸 optimization worktree 的分支名解析为 auto/opt-optimization（sed 's/^opt-//;s/^/opt-/' 对无 opt- 前缀的 basename 反而前置 opt-），fallback git merge --squash optimization 亦失败（optimization 非 ref，真实 ref=auto/optimization）→ 脚本走 else 分支 git merge --abort 退出。这是 #1 项目自身工具的结构性 bug，但属另一工作单位，本轮不修。",
  "action": "gate(.autonomous_active 标记)缺席→休眠，且 repo 历史多见 main 上 merge commit（accc91e 等），合并已审 worktree 是 sanctioned 的人工批准步骤。手动 git merge --squash auto/optimization（fast-forward，仅暂存 scout-scan.py）→ git commit 仅提交已暂存的 scripts/scout-scan.py（不触及 dirty state.md / 未跟踪 case 文件）→ 清理 worktree(git worktree remove --force + git branch -D auto/optimization)。opt-worktree.sh cmd_merge 分支名 bug 留待下轮修。",
  "files_changed": ["scripts/scout-scan.py"],
  "worktree": "main（直接 squash 合并；optimization worktree 合并后已清理删除）",
  "direction": "engine:debt-scan-precision-merge",
  "outcome": "succeeded",
  "outcome_evidence": [
    "git log --oneline -1 = 4dc2565 merge: 合并 optimization worktree (engine:debt-scan-precision) — scout-scan.py _STRIP_BACKTICKS 假阳修复",
    "grep -c _STRIP_BACKTICKS scripts/scout-scan.py(main) = 3（合并前=0）",
    "git diff --cached --name-only 合并前仅 scripts/scout-scan.py（state.md dirty 未暂存、case 文件未跟踪，均未进合并 commit）",
    "scout-scan 合并后实测 AS: 标记 TODO=3 FIXME=0 HACK=0（合并前 TODO=6），延期(已triage) TODO=4（合并前=7，4 个真实代码 TODO(deferred) 全保留），score 0.07→0.04",
    "git worktree list 仅剩主仓 + opt-skills-1782736482；auto/optimization 分支已 git branch -D 删除（was 20c9dca）",
    "git merge --squash auto/optimization 输出 'Fast-forward' + 'Squash commit -- not updating HEAD'，无冲突",
    "worktree 副本 ast.parse(scout-scan.py) 通过；scout --json 跑通无异常"
  ],
  "next_suggestion": "(1) 修 opt-worktree.sh cmd_merge 分支名 bug：把 'auto/$(basename $dir | sed ...)' 改为 'auto/$(basename $dir)'（basename 即分支后缀，对 optimization→auto/optimization、opt-skills-*→auto/opt-skills-* 均正确；sed 对裸 optimization 反前置 opt- 是根因）——1 行改动，但需走 worktree 提交，且修后仍在 worktree 未达 main，合并仍需先有可用的 fixed 脚本，chicken-and-egg 可直接 main 修(同本轮先例)或先 merge 再用。(2) AS 剩 3 active TODO 全在 .claude/decisions/decision-archive.md 历史案例标题散文（如 'Case 37: ...真实 # TODO: bff_client...'，TODO: 在标题非代码债）——评估给 count_markers 加'markdown 标题行(# 开头)不计 marker'或排除 .claude/decisions/ 目录，需跨项目验证对 .md 围栏代码块真债无影响。(3) opt-skills-1782736482(skills:GATES.md +38) 仍待人工合并。"
}
