{
  "case_id": "case-2026-06-30-277",
  "agent_id": "ralph-wiggum-autonomous-loop",
  "timestamp": "2026-06-30T21:25:00Z",
  "project": "autonomous-studio",
  "work_unit": "review + merge 待合并 worktree opt-cases-1782766175（cases:archival-merge：归档 case-274/275/276 三 commit 入 AS main）",
  "situation": "scout-scan @本轮 #1=1BfrYW9R(score=0.0,无明确小工作单位可跳过),#2=autonomous-studio(score=0.0) 推荐 'review 1 个待合并 worktree'。AS 当时有 1 个 pending worktree opt-cases-1782766175(含 3 commits: case-274/275/276 归档)。这些 case 是上轮 loop 在 1BfrYW9R 跨项目工作的元数据记录,因 [[case-file-orphan-on-cross-project-work]] 已知缺陷(case 写 AS main 但工作提交进目标项目 worktree)已手工 cp 入 cases worktree 补救。本任务是审 diff + merge 收口。约束检查:.claude/autonomous-constraints.md 仅排除 moni 前端重构,AS 不受限。",
  "action": "(1) bash scripts/opt-worktree.sh autonomous-studio show opt-cases-1782766175 审 diff:3 文件 +69/-0,纯 .claude/decisions/case-2026-06-30-{274,275,276}.json 新增,无代码改动,无 .opt-direction 变更——与 worktree commit messages('opt(cases:archival-merge): 归档 case-...')逐字一致。(2) 核 case-276.json outcome_evidence 引用的外部事实(git log 5ec70ae/npm test 23 pass/node build.js '30 JSX components')在上轮 merge 时已验证过,本轮仅复核 JSON 结构合规(字段齐全/outcome 枚举合法/evidence 非散文)。(3) bash scripts/opt-worktree.sh autonomous-studio merge opt-cases-1782766175 → fast-forward squash 合并入 main(b65d309),worktree 自动清理。arg 顺序照旧 project-first(避坑 [[opt-worktree-root-as-copy-drift]])。(4) 合后核实:git log -1 b65d309 / git status --short 空 / opt-worktree.sh list 仅剩 standing optimization(0 提交)。全程未 Read 任何源文件(纯 case 元数据 review,符合纪律'不深读大块代码')。",
  "files_changed": [
    "autonomous-studio/.claude/decisions/case-2026-06-30-274.json",
    "autonomous-studio/.claude/decisions/case-2026-06-30-275.json",
    "autonomous-studio/.claude/decisions/case-2026-06-30-276.json"
  ],
  "worktree": "opt-cases-1782766175(已 merge + 清理)",
  "direction": "cases:archival-merge",
  "outcome": "succeeded",
  "outcome_evidence": [
    "git -C autonomous-studio log --oneline -1 → b65d309 'merge: 人工批准合并 optimization worktree opt-cases-1782766175'",
    "git -C autonomous-studio status --short → 空(main dirty=0)",
    "ls autonomous-studio/.claude/decisions/case-2026-06-30-27[456].json → 三文件均存在(合前 main 不存在,git show main:... 报 fatal)",
    "bash scripts/opt-worktree.sh autonomous-studio list → 仅剩 standing optimization worktree(0 提交),opt-cases-1782766175 已不在列",
    "scout-scan 截断显示的'待处理 worktree: 共1, 待合并=1'计数归零(下轮重扫可证)"
  ],
  "next_suggestion": "(1) 下轮 scout-scan 重跑取真实 #1(全员 score=0.0 时挑真功能单位非 doc 润色)。候选:1BfrYW9R Phase 2 表单校验/空状态骨架屏、Phase 3 错误上报(⑧/㉑ 防漂移锁已自守);personal-assistant android Robolectric 扩测;sunset-prediction 核销 GATES 剩余门禁;wechat-main pipeline audit(/wechat-pipeline-audit skill 可用)。(2) 结构性修复仍待做(高 ROI 但需改脚本,适合专轮):case-id 根因(loop agent 自挑号绕过 next-case)[[case-id-collision-agent-self-pick]];跨项目孤儿 case(opt-worktree.sh step5 让 case 跟随目标项目 worktree)[[case-file-orphan-on-cross-project-work]];两副本同改纪律 [[opt-worktree-root-as-copy-drift]]。这三项都是 autonomous-studio engine 自身改进,若下轮 AS 排 #1 且无更紧迫项目债,可选其一作为 engine:general 方向工作单位。(3) 清理已合未删残留 auto/ 枝(低优先,auto/ 枝不触 gate,纯卫生)。(4) moni 前端重构仍 constraints 排除;moni 后端/量化允许但当前 score=0.0 无明确单位,除非主动挖缺口否则顺延。"
}
