{
  "case_id": "case-2026-06-30-004",
  "agent_id": "ralph-wiggum-loop",
  "timestamp": "2026-06-29T16:23:45Z",
  "project": "1BfrYW9R",
  "work_unit": "review-and-merge opt-tests-1782749552 (smoke ② 去硬编码 29)",
  "situation": "scout-scan #1 推荐 review 1BfrYW9R 待合并 worktree opt-tests-1782749552。该 worktree 含 1 commit (4907402): smoke.test.js 把 GATE ② 从硬编码 '29 JSX components' 改为从 build.js stdout 解析 N 并断言 N>0,新增/删除组件不必改测试;同步 GATES.md 描述与负测注释。",
  "action": "git show --stat + git show diff 审查变更 → cd worktree 跑 node test/smoke.test.js 验证 12/12 pass → git merge --no-ff 入 onedaybot-dev → git worktree remove + branch -d 清理",
  "files_changed": [
    "test/smoke.test.js",
    "GATES.md",
    ".opt-direction"
  ],
  "worktree": "opt-tests-1782749552 (已合并+清理)",
  "direction": "tests:smoke-no-hardcode",
  "outcome": "succeeded",
  "outcome_evidence": "node test/smoke.test.js in worktree: tests 12, pass 12, fail 0, duration_ms 1026.306402; git merge made by ort strategy, 3 files changed, 13 insertions(+), 10 deletions(-); worktree removed + branch auto/opt-tests-1782749552 deleted",
  "next_suggestion": "autonomous-studio 仍有 1 待合并 worktree (#2 推荐),下轮可审;或推进 personal-assistant/sunset-prediction 的文档润色(均 score=0.0 但 PROGRESS 0.6d 略 stale)"
}
