{
  "case_id": "case-2026-06-30-294",
  "agent_id": "ralph-autonomous-loop",
  "timestamp": "2026-06-30T22:30:00Z",
  "project": "1BfrYW9R (oneday-design)",
  "work_unit": "docs:progress-milestone-sync — sync PROGRESS.md 最近里程碑 to landed ㉒ port-range-guard + clear stale .opt-direction",
  "situation": "scout-scan 排 #1 为 1BfrYW9R，理由「健康度良好，无明确小工作单位」。深查发现结构性 doc-drift：deploy:port-range-guard 工作已全量落地（dev-server.js line 14 `!Number.isInteger(port) || port < 1 || port > 65535` 守卫 + smoke.test.js:1061 ㉒ 越界端口回归测试 + GATES.md 实测 24 pass 0 fail 声明 + GATES ㉒ 枚举全文档化，merge e19c1da），但 PROGRESS.md「最近里程碑」仍停在前一个 ㉑ gates-doc-drift（23 pass 0 fail），㉒ 落地时 PROGRESS 未同步；且 .opt-direction 仍携带 stale 的 `deploy:port-range-guard` tag（工作已 merge，tag 误导下轮重做已完成工作）。GATES.md canonical 声明 24 pass，PROGRESS 落后一整个里程碑。scout-scan 不读 .opt-direction 故未报此 gap，只笼统说「可做文档润色」。",
  "action": "1) 跑 npm test 确认基线 24 pass 0 fail、㉒ 测试存在且过。2) 突变复测取真实证据：把 dev-server.js line 14 守卫条件改为 `if (false)` 全 disabling 后跑套件——㉒ 转红 not ok 23 / pass23/fail1（守卫被废则越界 PORT 走 server.listen() 同步抛 RangeError uncaught 带栈，断言 exit 非0+invalid port+无栈 失败）；还原后 24 pass 0 fail 复绿（grep 确认 `if (false) { // MUTATION` 计 0、`if (!Number.isInteger` 复位 line 14）。3) 编辑 PROGRESS.md line 9：前置 ㉒ 越界端口范围守卫回归锁为「最近里程碑」（含真实突变证据：line 14 改 if(false) 后 ㉒ 转红 not ok 23/pass23/fail1，还原 24 pass），原 ㉑ gates-doc-drift 降为「承接」；补记 deploy 通道至此闭合（仅余 Phase 1 真实后端 API endpoint，依赖 personal-assistant 后端，留后）。4) .opt-direction 由 stale `deploy:port-range-guard` pivot → `forms:validation`（Phase 2 表单校验，deploy 已闭合）。5) 复测 npm test 24 pass 0 fail（PROGRESS 不在 ⑧/gates-doc-drift 扫描范围，本改不触发计数断言）。6) opt-worktree commit 到新 worktree（方向分歧 engine→docs 自动开新枝）。",
  "files_changed": ["1BfrYW9R/PROGRESS.md", "1BfrYW9R/.opt-direction"],
  "worktree": "opt-docs-1782772510 (1BfrYW9R project; 新开，方向 docs:progress-milestone-sync，待人工审 merge/reject)",
  "direction": "docs:progress-milestone-sync",
  "outcome": "succeeded",
  "outcome_evidence": "commit 进 opt-docs-1782772510（opt-worktree.sh 输出「✓ 提交到 opt-docs-1782772510 方向=docs:progress-milestone-sync」）；npm test 复测 `# tests 24 / # pass 24 / # fail 0`；突变复测实跑输出 `not ok 23` + `# pass 23 / # fail 1`（守卫 disabling 后㉒真咬），还原后 grep `if (false) { // MUTATION` 计 0 且 `if (!Number.isInteger` 复位 line 14；PROGRESS.md line 9 现以「2026-06-30 越界端口范围守卫回归锁 —— `npm test` ㉒」开头（在 worktree 内，main 未动）；.opt-direction cat 输出 `forms:validation`。dev-server.js 本身零改动（仅突变测试时临时改已还原）。",
  "next_suggestion": "1) 人工审 1BfrYW9R opt-docs-1782772510 的 diff（仅 PROGRESS.md+.opt-direction 两文件，无代码/测试改动，低风险）→ merge 或 reject。2) 下轮若 1BfrYW9R 仍排 #1：.opt-direction 已 pivot 到 forms:validation（Phase 2 表单校验与错误提示），可读 index.html 内表单组件（SettingsPage/收件箱等）做最小表单校验+错误提示实现，或加 loading/空状态骨架屏；属 Phase 2 真实功能开发（非文档润色），需读组件源故体量稍大，按小工作单位拆。3) 亦可顺延 scout-scan #2 autonomous-studio（review 2 个待合并 worktree，人工审 diff + merge/reject）——符合 AS 自身待办且价值高。"
}
