{
  "case_id": "case-2026-06-27-011",
  "agent_id": "ralph-wiggum-autonomous-loop",
  "timestamp": "2026-06-27T09:50:00Z",
  "project": "autonomous-studio",
  "work_unit": "triage autonomous-studio 剩余真实 # TODO: bff_client.py:206（scout-scan 推荐 #1 的 TODO triage 收尾，case-010 移交项）——把迁移期兼容分支的模糊删除条件标注为可裁决的删除条件+删除范围",
  "situation": "scout-scan（workspace 副本=opt-scanner-1782549922 部署的修复版）报告 autonomous-studio score≈1.06 仍 #1，推荐 'triage 前 1-2 个 TODO'。count_markers 实测 TODO=4。先按 grep 顺序取前 2 个（apply_resource_access.py:85/90）尝试 triage，opt-worktree commit 时 stash apply 冲突——发现这 2 个 TODO 已被上轮 case-010 在 opt-skills-1782553243(commit 26833e9) triage 过（annotation 更详尽：含 getDetail(entityType=...) 验证命令 + searchTables fallback）。属重复工作，stash drop + worktree reset --hard HEAD 清理。随即查 case-010 NEXT_SUGGESTION #3 移交的剩余 2 个：bff_client.py:206 / scaffold-skill.sh:136。确认无 pending worktree 触碰 bff_client.py（opt-skills-1782553243 仅改 apply_resource_access.py）。取 bff_client.py:206 接续 triage。",
  "action": "Read bff_client.py:203-214 确认上下文：_load_profile 的迁移期兼容分支——旧 dist 无 profile.json 时返回 public 默认 + warnings.warn(DeprecationWarning)。原 TODO '# TODO: 所有 dist 升级后删除此分支' 删除条件模糊。改为可裁决标注：'# TODO: 待人工裁决删除条件——所有部署环境的 dist 均已含 profile.json 时移除此兼容分支；可用 `find <dist-root> -name profile.json` 确认全覆盖后，连同下方 warnings.warn/print 兼容块一并删除'。刻意保留 `TODO: ` 形式（不改 TODO(owner): ——会被 scanner \\bTODO\\b\\s*[:-] 漏计=隐藏债务），故 TODO 计数不变=4，债务如实保留。1 文件改动，符合最小纪律。未碰 scaffold-skill.sh:136（留作下轮，避免多文件提交+Read 超 2 源文件）。ast.parse 语法校验通过。提交：opt-worktree.sh . commit 'skills:todo-triage'——area=skills 复用同 worktree opt-skills-1782553243（与 case-010 同 worktree，不同文件 pop 干净无冲突，commit 90aaeac 叠在 26833e9 之上）。",
  "files_changed": ["skills/dataworks-dev-assistant/core/bff_client.py"],
  "worktree": "autonomous-studio opt-skills-1782553243（分支 auto/opt-skills-1782553243，新增 commit 90aaeac 叠于 26833e9 之上，off main 34fe229，待人工 merge）",
  "direction": "skills:todo-triage",
  "outcome": "succeeded",
  "outcome_evidence": [
    "opt-worktree.sh 输出：'→ 复用同 area worktree: opt-skills-1782553243' + '✓ 提交到 opt-skills-1782553243 方向=skills:todo-triage'",
    "git -C opt-skills-1782553243 log --oneline main..HEAD = '90aaeac opt(skills:todo-triage): triage dataworks bff_client.py:206...'（其下 26833e9 = case-010 的 apply_resource_access triage）",
    "WT 内 bff_client.py:206-207 已含 'TODO: 待人工裁决删除条件——所有部署环境的 dist 均已含 profile.json 时移除此兼容分支；可用 find <dist-root> -name profile.json 确认全覆盖后...'（可观察，非散文）",
    "main 工作树 git status --short（除 ?? decisions/）无改动——stash 已 drop、worktree reset --hard HEAD 后 clean，重复 attempt 无残留",
    "TODO: 形式保留 → count_markers 不变 = TODO=4，2 个标注后的 TODO 仍被计入，债务未隐藏（符合 triage=标注语义）"
  ],
  "next_suggestion": "下轮 scout-scan 大概率仍 autonomous-studio #1（TODO=4 未降，标注非清掉，score≈1.06）。若仍 #1：triage 最后 1 个真实 # TODO: scaffold-skill.sh:136 '# TODO: 用真实运行回放写这盘带子,不要摆拍。'（luban scaffold 模板示例回放 TODO——标注 owner 或转 issue；注意它是模板内示例指引，非真债务，可考虑改写为非 TODO 形式的普通注释以降 TODO 计数）。若 AS 退 #2 则做 x-tool #1（TODO=6 triage）。⚠ 关键前置：本轮暴露 scout-scan 推荐引擎不感知 pending worktree——重复推荐已 triage 的 TODO（apply_resource_access 被 case-010 做过仍被荐），下轮若再撞已 triage 项应先 `git -C <wt> log main..HEAD` 查 pending 再动手。真正阻塞仍是 P0 main(34fe229)/worktree base(b725eb4) 历史分歧致 opt-scanner-1782549922/opt-skills 等 worktree 无法 ff-merge main，需人工裁决 rebase/reset。"
}
