{
  "case_id": "case-2026-06-30-334",
  "agent_id": "ralph-wiggum-autonomous-loop",
  "timestamp": "2026-06-30T04:30Z",
  "project": "huiyis",
  "work_unit": "新增 planning/status.json — 填 huiyis scout #1『无 planning/』结构性缺口",
  "situation": "scout-scan --workspace /home/admin/workspace 报 huiyis score=3.0 霸榜 #1，理由三条：PROGRESS.md 待合并(opt-docs-1782793013)、GATES.md 待合并(opt-docs-1782793013)、无 planning/。前两条为 pending worktree 待人工 merge（scout 明确标注『别重做』），不可自治重做；第三条『无 planning/』是唯一可自治、可逆、未触排除项的结构性缺口。huiyis 是已上线 Skill（a4-meeting-room-booking v0.1.2，每天 12:00 抢下周同日 5 时段会议室），缺 planning/ 让 scout 健康分虚高。",
  "action": "新建 huiyis/planning/status.json（1 文件，最小改动）。格式仿 1BfrYn9G/planning/status.json 极简 Studio 阶段追踪 schema（currentStage/completedStages/lastUpdated/taskType/locked/autoAdvance/notes/milestones），扩展 milestones 三段。内容 grounded 于可观察事实：SKILL.md frontmatter（name=a4-meeting-room-booking, version=0.1.2）、git log（0a96a51 周三并行抢订 / cead9d9 停火 join 等待 / a484638 即时取结果）、SKILL.md 触发时机（每天 12:00/5 时段/5F 首选+4-6F 兜底/钉钉回写）。stage=deployed、taskType=skill-maintenance、locked=false 反映维护态。仅 Read 2 个 sibling status.json 模板（agentfw + 1BfrYn9G）+ huiyis SKILL.md frontmatter 20 行，未深读源码。opt-worktree.sh commit docs:planning-status — area=docs 与 pending opt-docs-1782793013 同 area，按脚本方向判定复用同一 worktree 累积（不另开、不碰 main）。",
  "files_changed": ["huiyis/planning/status.json"],
  "worktree": "huiyis/opt-docs-1782793013 (累积第 3 提交 92dd175，与 59f9182 PROGRESS.md + fdca397 GATES.md 共 3 提交 3 files +102 行待人工 merge)",
  "direction": "docs:planning-status",
  "outcome": "succeeded",
  "outcome_evidence": "commit 92dd175 落地于 opt-docs-1782793013（git log --oneline -3 确认首位）；opt-worktree list 显示该 worktree『3 提交 | 3 files changed, 102 insertions(+)』；planning/status.json 经 python3 -c json.load 校验 JSON OK；huiyis master git status --short 为空（main 未被碰，零 WIP 泄漏）；scout #1 三条理由中『无 planning/』已填，待人工 merge 后 score 应从 3.0 下降（PROGRESS.md+GATES.md+planning/ 三缺口一次性闭合）。",
  "next_suggestion": "【需人工·低阻力】opt-worktree.sh /home/admin/workspace/huiyis merge opt-docs-1782793013 一次性落地 PROGRESS.md+GATES.md+planning/status.json（3 文件 +102 行零冲突，area=docs 一致）；merge 后 huiyis 三条 scout 缺口全闭、score 应跌出 #1，下轮 scout #1 易主（候选 #2 autonomous-studio score=0.03 triage 3 个 TODO，或 #3 1BfrYn9G review 2 待合并 worktree）。AS 仓 opt-scout-1782792420 仍待人工 merge 解引擎失明——merge 后 scout 可见 AS 自身。"
}
