{
  "case_id": "case-2026-06-29-057",
  "agent_id": "ralph-wiggum-autonomous-loop",
  "timestamp": "2026-06-29T23:14Z",
  "project": "autonomous-studio-aone (engine)",
  "work_unit": "engine:files-array-quoting — cmd_commit 把 files 从字符串 \"${@:5}\" 改为 bash 数组，修复含空格文件名被 IFS 分词切碎的静默丢文件 bug",
  "situation": "scout-scan 全项目 blocked（skills #1 等 opt-docs-1782736126 合并；4+ pending worktree 待人工合并），项目侧无可操作单位。引擎侧不 blocked，取上轮 NEXT_SUGGESTION(4) 候选：opt-worktree.sh cmd_commit 的 `local files=\"${@:5}\"` + `for f in $files`。审查 scripts/opt-worktree.sh:99/107/109/135/137 确认 bug：${@:5} 拼成空格分隔字符串再 unquoted for 循环按 IFS 分词，含空格的文件名被切碎为多 token，每个 token 经 [[-e \"$f\"]] 失败后 continue 静默跳过 → 文件根本没被 cp 进 worktree、从提交丢失且无告警。cp/还原两处 for 循环同病。",
  "action": "最小改动单文件 scripts/opt-worktree.sh：(1) `local files=\"${@:5}\"` → `local -a files=(\"${@:5]}\")`（数组原样保留每个 argv，含空格）；(2) 两处 `if [[ -n \"$files\" ]]` → `if [[ ${#files[@]} -gt 0 ]]`；(3) 两处 `for f in $files` / `for f2 in $files` → `for f in \"${files[@]}\"` / `for f2 in \"${files[@]}\"`。循环体已 quote \"$f\"/\"$f2\"，迭代器修好后下游天然安全。未触碰 else 分支（git status --porcelain -z 路径本就 NUL 分隔不受影响）。",
  "files_changed": ["scripts/opt-worktree.sh"],
  "worktree": "optimization (branch auto/optimization, commit b8458a6) — 现 7 待合并提交",
  "direction": "engine:files-array-quoting",
  "outcome": "succeeded",
  "outcome_evidence": [
    "bash -n scripts/opt-worktree.sh → OK（语法通过）",
    "bash 实测：set -- ... 'file with space.txt' 'normal.txt'；旧 `for f in $oldfiles` 输出 4 段 [file]/[with]/[space.txt]/[normal.txt]（确认裂碎）；新 `for f in \"${files[@]}\"` 输出 2 段 [file with space.txt]/[normal.txt]（确认保留）",
    "git diff b8458a6 -- scripts/opt-worktree.sh 显示 3 处 for/if 改动落地、循环体下游 cp/checkout 行未动",
    "opt-worktree.sh . commit 成功输出 '✓ 提交到 optimization 方向=engine:files-array-quoting'，断言通过（worktree 有新 commit b8458a6 + main 该文件已 checkout HEAD 还原至干净，git status --short 无输出）",
    "worktree git log main..HEAD 现 7 提交（marker-md-exclusion / merge-branch-cleanup / self-index-guard / merge-checkout-guard / direction-meta-exclusion / show-truncation-guard / files-array-quoting）"
  ],
  "next_suggestion": [
    "人工 opt-worktree.sh . show optimization 审 → merge 落地 main（现 7 提交全是结构性修复，show-truncation-guard 已确保审阅 diff 不被 head -300 静默截断；files-array-quoting 是其中最小最干净的，可整批一起合并）",
    "scout 仍全 blocked——核心阻塞 4+ pending worktree(opt-agent-dashboard-1782738987/opt-browser-use-1782738573/opt-docs-1782736126/opt-xtool-1782743518)待人工合并，建议人工批量 merge 解锁项目侧轮转",
    "下一 engine 小单位候选：(a) cmd_commit 第④断言 `git status --porcelain -- $files` 中 $files 现已是数组需改 \"${files[@]}\" 同病（本次未碰，因属断言非提交主路径，但同源 bug 应一并修）；(b) cmd_show 仍 head -300 硬截断（上轮 show-truncation-guard 只加省略量提示未去掉上限）；(c) 转向项目侧 deferred TODO（stagehand 7/x-tool 6/open-design 2/shizi 1，已 triage 非阻塞）"
  ]
}
