{
  "case_id": "case-2026-06-29-016",
  "agent_id": "autonomous-loop-ralph",
  "timestamp": "2026-06-29T17:40Z",
  "project": "x-tool",
  "work_unit": "triage moni/factors Python TODO 注释：标注 6 个 TODO 为 (deferred)",
  "situation": "scout-scan 以 score=1.03 将 x-tool 排为 #1，原因是 7 个 TODO 标记且无 planning/。上一轮（case-015）已处理 CLAUDE.md 占位符，本轮处理剩余 6 个 Python 代码 TODO：broker_qmt.py（QMT broker 4 个 stub）、run_trader.py（盘中逻辑占位）、download_sw_industry.py（SW行业映射占位）。这些 TODO 均依赖 QMT API 安装，无法在当前环境实现，属合理延期。",
  "action": "将 6 个 `# TODO:` 注释改为 `# TODO (deferred):`，符合项目延期债约定（scout-scan 脚本识别此格式并排除出债务计数）。通过 opt-worktree.sh 提交到新 worktree opt-moni-1782668136（因方向 moni:triage 与上一 worktree 的 docs:triage 分歧，自动开了新 worktree）。",
  "files_changed": [
    "moni/factors/scripts/qlib_repo/trader/broker_qmt.py",
    "moni/factors/scripts/qlib_repo/trader/run_trader.py",
    "moni/factors/scripts/alpha_graph/tools/download_sw_industry.py"
  ],
  "worktree": "opt-moni-1782668136",
  "direction": "moni:triage",
  "outcome": "succeeded",
  "outcome_evidence": "opt-worktree.sh 输出 '✓ 提交到 opt-moni-1782668136  方向=moni:triage'；worktree 中 broker_qmt.py 行 70/79/86/96 均已更新为 '# TODO (deferred):' 格式，验证通过。",
  "next_suggestion": "1) 人工批准合并 opt-moni-1782668136（3 文件，moni/factors TODO deferred 标注）；2) 人工批准合并 opt-docs-1782659755（dongxiao + claude CLAUDE.md 占位符填充）；3) x-tool 剩余 1 个未定位 TODO（scout 报告 7 个，本轮处理 6 个）——若合并后 scout 重扫分数降为 0，则可转向 stagehand-analysis 补 planning/ 目录"
}
