{
  "case_id": "case-2026-06-28-077",
  "agent_id": "ralph-autonomous-loop",
  "timestamp": "2026-06-28T14:30:00Z",
  "project": "quanzhan",
  "work_unit": "补 GATES.md（质量门禁三级，1 文件）",
  "situation": "scout-scan #1 项目 quanzhan（score=6.0）缺 GATES.md；PROGRESS.md 已在 opt-docs-1782640587 worktree 待合并。无 planning/。项目为 React + TypeScript + Express + Webpack 全栈学习路线展示站。",
  "action": "在 /home/admin/workspace/quanzhan 创建 GATES.md，内容含 CRITICAL（构建/TS 类型检查/Express 语法检查）、IMPORTANT（字段完整性/类型标注）、NICE（移动端/排序/端口配置）三级门禁。通过 opt-worktree.sh 提交到已有 worktree opt-docs-1782640587（docs area 复用）。",
  "files_changed": ["GATES.md"],
  "worktree": "opt-docs-1782640587",
  "direction": "docs:gates",
  "outcome": "succeeded",
  "outcome_evidence": "opt-worktree.sh 输出 '✓ 提交到 opt-docs-1782640587 方向=docs:gates'；文件已在 /home/admin/workspace/quanzhan/GATES.md 创建并进入 worktree 提交。",
  "next_suggestion": "下轮可处理 #2 text-counter-extension 补 GATES.md，或合并 quanzhan/opt-docs-1782640587 worktree（如用户批准）。browser-use TODO=34 标记密度较高，可作为 #3 债务清理目标。"
}
