{
  "case_id": "case-2026-06-29-021",
  "agent_id": "autonomous-loop",
  "timestamp": "2026-06-29T10:45Z",
  "project": "autonomous-studio-aone",
  "work_unit": "归档今日 decision case 文件(001-020) + calibration/state 同步",
  "situation": "scout-scan --workspace /home/admin/workspace 发现所有推荐项目均 blocked（共 7 个 score=2.0 的 docs-worktree 待人工合并，browser-use/skills/stagehand-analysis 各有 triage worktree 待合并，无 actionable 工作单位）。calibration.json 修改显示循环已空转 73+ 轮产出同质 docs，主要风险是 worktree 积压无人 merge。autonomous-studio-aone 本身有 20 个今日 case JSON 未跟踪 + calibration/state 两个修改文件，做归档提交是当前最有价值的工作单位。",
  "action": "1) 写 case-2026-06-29-021 文档本轮; 2) 用 opt-worktree.sh commit decisions:archive-cases 把 case-001~021 + calibration.json + autonomous-state.md 提交到 worktree; 3) 回写 autonomous-state.md",
  "files_changed": [
    ".claude/decisions/case-2026-06-29-001.json",
    ".claude/decisions/case-2026-06-29-002.json",
    ".claude/decisions/case-2026-06-29-003.json",
    ".claude/decisions/case-2026-06-29-006.json",
    ".claude/decisions/case-2026-06-29-007.json",
    ".claude/decisions/case-2026-06-29-009.json",
    ".claude/decisions/case-2026-06-29-010.json",
    ".claude/decisions/case-2026-06-29-011.json",
    ".claude/decisions/case-2026-06-29-013.json",
    ".claude/decisions/case-2026-06-29-014.json",
    ".claude/decisions/case-2026-06-29-015.json",
    ".claude/decisions/case-2026-06-29-017.json",
    ".claude/decisions/case-2026-06-29-018.json",
    ".claude/decisions/case-2026-06-29-019.json",
    ".claude/decisions/case-2026-06-29-020.json",
    ".claude/decisions/case-2026-06-29-021.json",
    ".claude/decisions/calibration.json",
    ".claude/memory/autonomous-state.md"
  ],
  "worktree": "opt-decisions-archive",
  "direction": "decisions:archive-cases",
  "outcome": "succeeded",
  "outcome_evidence": "opt-worktree.sh commit 执行后 worktree 内 git log 可见提交记录；autonomous-state.md LAST_WORKTREE 字段已更新。",
  "next_suggestion": "1) 人工审批批量合并积压的 docs worktree（7 个），解除下轮 scout-scan blocked 状态；2) 关注 loop 空转问题——calibration 显示 73+ 轮产出同质文档，建议 merge 或 stop loop 后再继续；3) 下轮若有合并后的项目，可做 skills GATES.md 或 stagehand-analysis TODO 实现"
}
