{
  "case_id": "case-2026-06-29-001",
  "agent_id": "ralph-wiggum-autonomous-loop",
  "timestamp": "2026-06-29T03:13:37Z",
  "project": "1BfrYW9R",
  "work_unit": "清理空 worktree（auto/optimization 已 0 ahead，仅含 stale .opt-direction 漂移）",
  "situation": "scout-scan #1 推荐：1BfrYW9R score=0.0，待处理 worktree=1(空可清理)。检查发现 auto/optimization 分支 0 ahead of onedaybot-dev，但工作区有 .opt-direction 从 gates:audit 漂移到 engine:general（未提交），README.md 显示为 deleted（因 reset 后与 main 一致）。属 scout-scan 标记的空 worktree 清理任务。",
  "action": "git reset --hard onedaybot-dev 将 worktree 重置到与 main 完全一致，消除未提交的 .opt-direction 漂移和虚假 README.md 删除状态。无新提交（reset 不产生 commit）。验证：status 为空，rev-list --count = 0。",
  "files_changed": [],
  "worktree": "/home/admin/workspace/.opt-worktrees/1BfrYW9R/optimization",
  "direction": "worktree-hygiene",
  "outcome": "succeeded",
  "outcome_evidence": "git status --short 输出为空；git rev-list --count auto/optimization ^onedaybot-dev = 0；worktree 目录仍存在但内容与 main 完全同步，scout-scan 下次扫描应将该 worktree 归类为'空(可清理)'或直接识别为已同步。",
  "next_suggestion": [
    "若下轮 scout-scan 仍列 1BfrYW9R 空 worktree，可用 git worktree remove 彻底删除 /home/admin/workspace/.opt-worktrees/1BfrYW9R/optimization",
    "autonomous-studio 有 6 个延期 TODO（已 triage），可挑一个做实际修复而非文档润色",
    "shizi 有 1 个待合并 worktree(opt-build)，下轮可检查是否可 merge 入 main"
  ]
}
